### ISSUE TITLE
Push not working when surfing to website root

### ISSUE THREAD

**Issue by twdkeule** [mholt/caddy#1744]
### 1. What version of Caddy are you using (`caddy -version`)?
Compiled from master branch
(I am using the latest Chromium).

### 2. What are you trying to do?
I'm trying to push resources when a client browses to the homepage. However nothing is pushed when surfing to https://foo.bar, only when surfing explicitly to https://foo.bar/index.html

### 3. What is your entire Caddyfile?
```text
https://thesis_server.be:6121
root ./website
tls ./website/cert.crt ./website/cert.key
push /index.html {
    /dash.all.debug.js
    /thesis.js
    /video/2000/manifest.mpd
    /video/2000/240/segment_init_240.mp4
    /video/2000/240/segment_0000_240.mp4
}
```

### 4. How did you run Caddy (give the full command and describe the execution environment)?
`./caddy -http2=true -log stdout`

### 5. Please paste any relevant HTTP request(s) here.
For this request nothing is pushed:
```
Frame 65: 342 bytes on wire (2736 bits), 342 bytes captured (2736 bits) on interface 0
Ethernet II, Src: 00:00:00_00:00:00 (00:00:00:00:00:00), Dst: 00:00:00_00:00:00 (00:00:00:00:00:00)
Internet Protocol Version 4, Src: localhost (127.0.0.1), Dst: localhost (127.0.0.1)
Transmission Control Protocol, Src Port: 32808, Dst Port: 6121, Seq: 487, Ack: 1679, Len: 276
Secure Sockets Layer
HyperText Transfer Protocol 2
    Stream: HEADERS, Stream ID: 1, Length 238
        Length: 238
        Type: HEADERS (1)
        Flags: 0x25
        0... .... .... .... .... .... .... .... = Reserved: 0x0
        .000 0000 0000 0000 0000 0000 0000 0001 = Stream Identifier: 1
        [Pad Length: 0]
        1... .... .... .... .... .... .... .... = Exclusive: True
        .000 0000 0000 0000 0000 0000 0000 0000 = Stream Dependency: 0
        Weight: 255
        [Weight real: 256]
        Header Block Fragment: 82418b4ce54191120b6772d8bc6587844092b6b9ac1c8558...
        [Header Length: 444]
        [Header Count: 9]
        Header: :method: GET
        Header: :authority: thesis_server.be
        Header: :scheme: https
        Header: :path: /
        Header: upgrade-insecure-requests: 1
        Header: user-agent: Mozilla/5.0 (X11; Linux x86_64) AppleWebKit/537.36 (KHTML, like Gecko) Ubuntu Chromium/58.0.3029.110 Chrome/58.0.3029.110 Safari/537.36
        Header: accept: text/html,application/xhtml+xml,application/xml;q=0.9,image/webp,*/*;q=0.8
        Header: accept-encoding: gzip, deflate, sdch, br
        Header: accept-language: en-US,en;q=0.8
        Padding: <MISSING>
```

For this request, the relevant resources are pushed:
```
Frame 70: 342 bytes on wire (2736 bits), 342 bytes captured (2736 bits) on interface 0
Ethernet II, Src: 00:00:00_00:00:00 (00:00:00:00:00:00), Dst: 00:00:00_00:00:00 (00:00:00:00:00:00)
Internet Protocol Version 4, Src: localhost (127.0.0.1), Dst: localhost (127.0.0.1)
Transmission Control Protocol, Src Port: 60928, Dst Port: 6121, Seq: 487, Ack: 1717, Len: 276
Secure Sockets Layer
HyperText Transfer Protocol 2
    Stream: HEADERS, Stream ID: 1, Length 238
        Length: 238
        Type: HEADERS (1)
        Flags: 0x25
        0... .... .... .... .... .... .... .... = Reserved: 0x0
        .000 0000 0000 0000 0000 0000 0000 0001 = Stream Identifier: 1
        [Pad Length: 0]
        1... .... .... .... .... .... .... .... = Exclusive: True
        .000 0000 0000 0000 0000 0000 0000 0000 = Stream Dependency: 0
        Weight: 255
        [Weight real: 256]
        Header Block Fragment: 82418b4ce54191120b6772d8bc6587854092b6b9ac1c8558...
        [Header Length: 454]
        [Header Count: 9]
        Header: :method: GET
        Header: :authority: thesis_server.be
        Header: :scheme: https
        Header: :path: /index.html
        Header: upgrade-insecure-requests: 1
        Header: user-agent: Mozilla/5.0 (X11; Linux x86_64) AppleWebKit/537.36 (KHTML, like Gecko) Ubuntu Chromium/58.0.3029.110 Chrome/58.0.3029.110 Safari/537.36
        Header: accept: text/html,application/xhtml+xml,application/xml;q=0.9,image/webp,*/*;q=0.8
        Header: accept-encoding: gzip, deflate, sdch, br
        Header: accept-language: en-US,en;q=0.8
        Padding: <MISSING>
```
### 6. What did you expect to see?
I expected Caddy to push the 5 resources specified for /index.html.

### 7. What did you see instead (give full error messages and/or log)?
Nothing was pushed wheb surfing to https://foo.bar
 (I have wireshark logs).

### 8. How can someone who is starting from scratch reproduce the bug as minimally as possible?
Try to push a resource for /index.html while surfing to the website (not foo.bar/index.html)

**Comment by twdkeule** [comment]
Also noticed:
when the client surfs to https://foo.bar/index.html, the server responds with a 301: moved to / Causing the client to request /, but only after all pushed resources have been sent, causing a significant delay

**Comment by midzer** [comment]
I think i can confirm this one

**Comment by mholt** [comment]
@twdkeule 

> when the client surfs to https://foo.bar/index.html, the server responds with a 301: moved to /. Causing the client to request /

That's intended; see #1743 and #1737 for more information.

Regarding push, the path checking probably doesn't consider index files to be specified like that. I'll have to think about a good way to handle it.

**Comment by twdkeule** [comment]
I made a quick fix: https://github.com/twdkeule/caddy/commit/b3c075d4236bdfd120da58f5be14cf17b2911d30
It is a bit hardcoded, but as far as I know the /index.html case should be the only one.

**Comment by tobya** [comment]
@twdkeule Thank you for the fix, however we need to be careful making any assumption about what file is the index file.  It can be anything really though in reality will most often be index.html.  You can get access to the current index file in middleware.go 
https://github.com/mholt/caddy/blob/133ed1837409296aed944ca7c18962ae9d80be70/caddyhttp/httpserver/middleware.go#L105

**Comment by mholt** [comment]
Great point, Toby. I'll continue to review the PR (with anyone's help if they would like to).
